{"artifacts":[{"bytes":100000000,"name":"example-0.0.1.tar.gz","sha256":"abababababababababababababababababababababababababababababababab"}],"manifests":[{"name":"example-0.0.1.rust-release-manifest.json","sha256":"cdcdcdcdcdcdcdcdcdcdcdcdcdcdcdcdcdcdcdcdcdcdcdcdcdcdcdcdcdcdcdcd"}],"prev_sha256":"0000000000000000000000000000000000000000000000000000000000000000","prev_version":"","product":"example","proofs":[],"published_utc":"2026-07-22T00:00:00Z","schema":"https://solpbc.org/schemas/transparency-ledger-entry/v1.json","seq":1,"source_commit":"0123456789abcdef0123456789abcdef01234567","version":"0.0.1"}
